{"$schema":"https://json-schema.org/draft/2020-12/schema","$id":"https://example.invalid/gd-evaluation/schemas/annotation-v0.1.schema.json","title":"Human Annotation v0.1","type":"object","additionalProperties":false,"required":["contract_version","annotation_id","session_id","annotator_id","rubric_version","created_at","dimensions"],"properties":{"contract_version":{"const":"0.1"},"annotation_id":{"type":"string","minLength":1},"session_id":{"type":"string","minLength":1},"annotator_id":{"type":"string","minLength":1},"rubric_version":{"const":"candidate-behavior-v0.1"},"created_at":{"type":"string","format":"date-time"},"dimensions":{"type":"array","minItems":7,"maxItems":7,"items":{"type":"object","additionalProperties":false,"required":["dimension","score","evidence_message_ids","comment"],"properties":{"dimension":{"enum":["issue_framing","logical_reasoning","listening_and_response","valuable_contribution","collaboration_and_relationship","decision_and_consensus","process_and_time_management"]},"score":{"oneOf":[{"type":"integer","minimum":1,"maximum":4},{"const":"NE"}]},"evidence_message_ids":{"type":"array","items":{"type":"string"}},"comment":{"type":"string"},"not_evaluable_reason":{"type":["string","null"]}}}}}}
