{"contract_version":"0.1","annotation_id":"annotation_example_001","session_id":"session_example_001","annotator_id":"reviewer_anon_001","rubric_version":"candidate-behavior-v0.1","created_at":"2026-08-04T05:30:00Z","dimensions":[{"dimension":"issue_framing","score":3,"evidence_message_ids":["message_001"],"comment":"比較基準を提示した。","not_evaluable_reason":null},{"dimension":"logical_reasoning","score":"NE","evidence_message_ids":[],"comment":"","not_evaluable_reason":"例示ログでは評価機会が不足"},{"dimension":"listening_and_response","score":"NE","evidence_message_ids":[],"comment":"","not_evaluable_reason":"例示ログでは評価機会が不足"},{"dimension":"valuable_contribution","score":"NE","evidence_message_ids":[],"comment":"","not_evaluable_reason":"例示ログでは評価機会が不足"},{"dimension":"collaboration_and_relationship","score":"NE","evidence_message_ids":[],"comment":"","not_evaluable_reason":"例示ログでは評価機会が不足"},{"dimension":"decision_and_consensus","score":"NE","evidence_message_ids":[],"comment":"","not_evaluable_reason":"例示ログでは評価機会が不足"},{"dimension":"process_and_time_management","score":"NE","evidence_message_ids":[],"comment":"","not_evaluable_reason":"例示ログでは評価機会が不足"}]}
